{
  "schema_version":1,"robot_id":"phantom01","build_profile":"Diagnostic",
  "qualification":{"qualification_only":true,"qualification_evidence_manifest_hash":"0000000000000000000000000000000000000000000000000000000000000000","actuator_scope_mask":0,"safety_observation_mask":0,"required_user_inputs":"NONE"},
  "human_mapping":{"arm_reach_min_technical_m":"NOT_APPLICABLE_NETWORK_ONLY","arm_reach_max_technical_m":"NOT_APPLICABLE_NETWORK_ONLY","max_mapping_scale":"NOT_APPLICABLE_NETWORK_ONLY"},
  "space":{"require_local_floor":false,"require_spatial_data_permission":false,"require_scene_support_for_qr":false,"require_anchor_support_for_qr":false,"require_current_room":false,"require_scene_floor_anchor":false,"scene_aware_ux_enabled":false},
  "hand_tracking":{"required":false,"wrist_joint":"Wrist","wrist_max_pose_age_ms":50,"wrist_dropout_grace_ms":null},
  "body_tracking":{"required":false,"joint_set":"UPPER_BODY","shoulder_joint":"Body_RightShoulder","require_iobt":false,"max_pose_age_ms":50,"qualification_profile_id":"NOT_APPLICABLE_NETWORK_ONLY","require_runtime_profile_match":false},
  "qr":{"required_markers":[],"required_only_before_ready":false,"runtime_tracking_required":false},
  "grasp":{"provider":"DISABLED","require_grasp_ready":false,"default_mapping":"IDENTITY","fallback_provider":"DISABLED"},
  "commissioning_bundle":{"expected_hash":"17e18488df22ff736b3ede887b82397b9e06f9ac052beed011dc6c2a7eeaaeb9"},
  "network":{"discovery_service_type":"_phantom-ev3._udp","discovery_domain":"local.","ip_family":"IPV4","default_port":30470,"protocol_version":1,"control_key_id":"phantom01-control","commissioning_key_id":null,"telemetry_max_age_ms":100,"hello_retry_ms":250,"hello_max_attempts":5,"ping_interval_ms":500,"ping_timeout_ms":750,"max_missed_pongs":3,"reconnect_delay_ms":250}
}
