{"body_tracking":{"joint_set":"UPPER_BODY","max_pose_age_ms":50,"qualification_profile_id":"NOT_APPLICABLE_NETWORK_ONLY","require_iobt":false,"require_runtime_profile_match":false,"required":false,"shoulder_joint":"Body_RightShoulder"},"build_profile":"Diagnostic","commissioning_bundle":{"expected_hash":"17e18488df22ff736b3ede887b82397b9e06f9ac052beed011dc6c2a7eeaaeb9"},"grasp":{"default_mapping":"IDENTITY","fallback_provider":"DISABLED","provider":"DISABLED","require_grasp_ready":false},"hand_tracking":{"required":false,"wrist_dropout_grace_ms":null,"wrist_joint":"Wrist","wrist_max_pose_age_ms":50},"human_mapping":{"arm_reach_max_technical_m":"NOT_APPLICABLE_NETWORK_ONLY","arm_reach_min_technical_m":"NOT_APPLICABLE_NETWORK_ONLY","max_mapping_scale":"NOT_APPLICABLE_NETWORK_ONLY"},"network":{"commissioning_key_id":null,"control_key_id":"phantom01-control","default_port":30470,"discovery_domain":"local.","discovery_service_type":"_phantom-ev3._udp","hello_max_attempts":5,"hello_retry_ms":250,"ip_family":"IPV4","max_missed_pongs":3,"ping_interval_ms":500,"ping_timeout_ms":750,"protocol_version":1,"reconnect_delay_ms":250,"telemetry_max_age_ms":100},"qr":{"required_markers":[],"required_only_before_ready":false,"runtime_tracking_required":false},"qualification":{"actuator_scope_mask":0,"qualification_evidence_manifest_hash":"0000000000000000000000000000000000000000000000000000000000000000","qualification_only":true,"required_user_inputs":"NONE","safety_observation_mask":0},"robot_id":"phantom01","schema_version":1,"space":{"require_anchor_support_for_qr":false,"require_current_room":false,"require_local_floor":false,"require_scene_floor_anchor":false,"require_scene_support_for_qr":false,"require_spatial_data_permission":false,"scene_aware_ux_enabled":false}}
