{"body_tracking":{"joint_set":"UPPER_BODY","max_pose_age_ms":50,"qualification_profile_id":"UNQUALIFIED","require_iobt":false,"require_runtime_profile_match":true,"required":true,"shoulder_joint":"Body_RightShoulder"},"build_profile":"Release","commissioning_bundle":{"expected_hash":"89b9b0c66d68fd4b6dac267b8abe2e67a3ef30b573d65ad268be54a0cb850f55"},"grasp":{"default_mapping":"IDENTITY","fallback_provider":"DISABLED","provider":"OPENXR_HAND_INTERACTION","require_grasp_ready":true},"hand_tracking":{"required":true,"wrist_dropout_grace_ms":null,"wrist_joint":"Wrist","wrist_max_pose_age_ms":50},"human_mapping":{"arm_reach_max_technical_m":"MEASURED_REQUIRED","arm_reach_min_technical_m":"MEASURED_REQUIRED","max_mapping_scale":"MEASURED_REQUIRED"},"network":{"commissioning_key_id":null,"control_key_id":"phantom01-control","default_port":30470,"discovery_domain":"local.","discovery_service_type":"_phantom-ev3._udp","hello_max_attempts":5,"hello_retry_ms":250,"ip_family":"IPV4","max_missed_pongs":3,"ping_interval_ms":500,"ping_timeout_ms":750,"protocol_version":1,"reconnect_delay_ms":250,"telemetry_max_age_ms":100},"qr":{"required_markers":["SHOULDER_LEFT","SHOULDER_RIGHT","TURRET_LEFT","TURRET_RIGHT","ELBOW_LEFT","ELBOW_RIGHT","GRIPPER_LEFT","GRIPPER_RIGHT","JAW_LEFT","JAW_RIGHT"],"required_only_before_ready":true,"runtime_tracking_required":false},"qualification":{"actuator_scope_mask":15,"qualification_evidence_manifest_hash":"0000000000000000000000000000000000000000000000000000000000000000","qualification_only":false,"required_user_inputs":"FULL_ARM","safety_observation_mask":15},"robot_id":"phantom01","schema_version":1,"space":{"require_anchor_support_for_qr":true,"require_current_room":false,"require_local_floor":true,"require_scene_floor_anchor":false,"require_scene_support_for_qr":true,"require_spatial_data_permission":true,"scene_aware_ux_enabled":false}}
